title,resume,date
Influence de vote: un parlementaire de Guelmim-Oued Noun révoqué par la CC,"La Cour constitutionnelle a donné ce jeudi son verdict au sujet de la révocation du Conseiller parlementaire, élu au sein du corps électoral des représentants des Conseils communaux et provinciaux et régionaux de Guelmim-Oued Noun, Othmane Aïla. En premier ressort, le conseiller avait été condamné pour « ",13 Déc 2019
Article 9 du PLF: Ouahbi corrige Ramid par rapport à son « double discours »,"Le Projet de loi de finances (PLF) 2019 a bel et bien été approuvé, en deuxième lecture, par la Chambre des représentants. Mais au cours des discussions précédant le vote final, le député PAM Abdellatif Ouahbi a taclé le ministre d’État chargé des Droits de l’homme et des Relations avec le parlement, Mustapha Ramid, à cause de ce qui’il a qualifié de « coup d’État » contre le tant contesté Article 9 du PLF. ",13 Déc 2019
PSU : Mounib se voit bien en Chef du gouvernement,"La Secrétaire générale du PSU a été l’invitée de l’émission web de Hespress « Niqach fi siassa » (Débat en politique) qui sera diffusée demain soir. Elle a notamment parlé de la situation où se trouvent actuellement les partis politiques, sur ses ambitions et celles de son parti, membre de la FGD, mais aussi de la place de la religion dans l’exercice de la politique au Maroc.",15 Déc 2019
Ahmed Arahmouch: Observations autour de la circulaire d’El Otmani sur l’Amazigh,,13 Déc 2019
Congrès de l’UNTM : Abdelilah Hallouti rempile pour un second mandat,"Tardivement dans la soirée du 14 décembre, le Secrétaire général de l’UNTM, Abdelilah Hallouti, a été réélu pour un second mandat à la tête de la centrale syndicale inféodée au PJD, au cours d’un congrès où il a été plébiscité à hauteur de 62,43 %.",15 Déc 2019
Mohammed VI félicite le nouveau président algérien et réitère son appel à ouvrir les frontières,"Le roi Mohammed VI a adressé un message de félicitations à Abdelmadjid Tebboune, suite à son élection président de la République algérienne démocratique et populaire.",15 Déc 2019
Fonctionnaires doctorants de l’Etat : Une grève « nationale » les mercredi et jeudi prochains,L’Union générale nationale des doctorants du Maroc se prépare à « ,15 Déc 2019
Hirak: L’association Thafra tient encore à Ahmed Zefzafi,"Moins d’une semaine après qu’Ahmed Zefzafi ait annoncé sa démission de la présidence de l’Association Thafra qui rassemble les familles des détenus du Hirak du Rif, son bureau dirigeant annonce son rejet de la démission présentée. Les membres de l’association ont affirmé leur attachement à la figure paternelle du leader du Hirak, Nasser Zefzafi en tant que coordinateur du mouvement familial qui demande la libération des activistes détenus.",16 Déc 2019
Les positions du Roi Mohammed VI en faveur de la Palestine saluées par Mahmoud Abbas,"Les positions du Roi Mohammed VI en faveur de la Palestine et des droits légitimes des Palestiniens, exprimées par le Souverain à l’occasion de la célébration du 50è anniversaire de la création de l’Organisation de la Coopération Islamique à Rabat, ont été saluées par le président palestinien, Mahmoud Abbas.",13 Déc 2019
Enseignants titulaires de diplômes supérieurs: Fin des hostilités et retour aux classes,"Après quasiment deux semaines de grève, de marches de protestation et de sit-in entre le siège du ministère de l’Education nationale et le parlement à Rabat, les enseignants titulaires de hauts diplômes annoncent leur retour aux classes scolaires. Leur Coordination nationale a pris cette décision après avoir débattu jusque tard, hier soir, sur les différentes options qui s’offrent devant les enseignants, notamment en proie à des procédures d’« abandon de poste », initiée par les différentes directions provinciales de l’Education nationale dont ils relèvent.  ",13 Déc 2019
Paris : El Malki et Kayouh présents au 4ème Forum parlementaire Maroc-France,"En présence de l’ambassadeur du royaume en France Chakib Benmoussa, le président de la première Chambre, Habib El Malki, et le vice-président de la deuxième Chambre, Abdessamad Kayouh, sont à l’Assemblée nationale française à Paris pour prendre part au 4e Forum Parlementaire Maroc-France. Une rencontre interparlementaire qui a ouvert ses travaux, vendredi 13 décembre, dans la capitale française.",14 Déc 2019
Clôture des travaux de la 28e session du Conseil supérieur des oulémas,"Les travaux de la 28ème session ordinaire du Conseil supérieur des Oulémas, tenue avec la Haute Approbation du roi Mohammed VI, Président du Conseil supérieur des oulémas, ont pris fin samedi à Rabat.",15 Déc 2019
Oujda : Session de formation sur la gouvernance et la gestion de la chose locale,"Le parti du Mouvement Populaire (MP) organise, les 14 et 15 décembre à Oujda, une session de formation dans le cadre du projet de « renforcement des capacités des conseillères des collectivités territoriales en matière de gouvernance et de gestion de la chose locale ».",15 Déc 2019
Essaouira : Vers un Conseil municipal des enfants,"Une réunion dédiée à la présentation du projet « Conseil municipal des enfants d’Essaouira » a été tenue récemment dans la cité des Alizés et ce, à l’initiative du Conseil municipal de la ville.",15 Déc 2019
L’art Gnaoua déclaré patrimoine culturel immatériel de l’humanité de l’Unesco,"L’art Gnaoua a été inscrit, jeudi à Bogotá, par le Comité intergouvernemental de sauvegarde du patrimoine culturel immatériel de l’Organisation des Nations Unies pour l’éducation, la science et la culture (Unesco) à la liste représentative du patrimoine culturel immatériel de l’humanité.",13 Déc 2019
Grand Prix de la francophonie : Abdeljalil Lahjomri reçoit le Grand Prix de l’Académie française,"Le Secrétaire perpétuel de l’Académie du Royaume du Maroc, Abdeljalil Lahjomri, a reçu, jeudi à Paris, le Grand Prix de la francophonie de l’Académie française.",13 Déc 2019
André Azoulay : La consécration de l’art Gnaoua rend justice à la Cité des Alizés,"L’art Gnaoua a été inscrit, jeudi à Bogota, par le Comité intergouvernemental de sauvegarde du patrimoine culturel immatériel de l’Organisation des Nations Unies pour l’éducation, la science et la culture (Unesco) à la liste représentative du patrimoine culturel immatériel de l’humanité. André Azoulay conseiller du Roi Mohammed VI, et président fondateur de l’Association Essaouira-Mogador (1992), a estimé qu’il s’agit là d’une reconnaissance à l’engagement la Cité des Alizés.",13 Déc 2019
Carla Ruaro enchante le public de la Bibliothèque Nationale de Rabat,"Le projet « Racine – Un piano en Amazonie » a été présenté, dans la soirée du 13 décembre, à la Bibliothèque Nationale du Royaume du Maroc (BNRM), en présence notamment de l’ambassadeur du Brésil à Rabat, Julio Glinternick Bitelli. Ce projet, porté par Carla Ruaro, consistait en un récital de piano et la projection d’un documentaire.",14 Déc 2019
Gad Elmaleh se confie sur sa situation amoureuse,Gad Elmaleh est un cœur à prendre. Invité dans l’émission « ,14 Déc 2019
46ème session de l’ARM : L’Inde et la mondialisation ou un géant en puissance,A l’Académie ,12 Déc 2019
"FIFM2019 : A bâtons rompus ave Bruce Beresford, réalisateur de « The contract »",Il a réalisé «,15 Déc 2019
Lalla Khadija préside la cérémonie d’inauguration du vivarium du Jardin zoologique national de Rabat,"La Princesse Lalla Khadija a présidé, vendredi, la cérémonie d’inauguration du vivarium du Jardin zoologique national de Rabat.",13 Déc 2019
CNPAC: l’aptitude médicale à la conduite en question,"Les 13 et 14 décembre 2019, l’Université Mohammed VI des sciences de la santé à Casablanca accueille le Congrès international sur la santé et la sécurité routière. Organisé par ",13 Déc 2019
CNPAC: l’aptitude médicale à la conduite en question,,13 Déc 2019
"Fès : Rencontre sur la « Régionalisation, gouvernance et dynamique socio-économique »","« Régionalisation, gouvernance et dynamique socio-économique » est le thème du colloque scientifique qui s’est ouvert, vendredi à Fès, à l’initiative de la Faculté des sciences juridiques, économiques et sociales de l’Université Sidi Mohammed Ben Abdellah.",14 Déc 2019
Tanger : Session de formation sur l’accès à l’audiovisuel au profit de plusieurs associations,"Une quarantaine d’associations de la région Tanger-Tétouan-Al Hoceima ont bénéficié, vendredi à Tanger, d’une session de formation sur l’accès à l’audiovisuel.",14 Déc 2019
Créations d’au-delà des murs: Le musée de BAM s’ouvre sur l’univers carcéral,"En marge de la journée nationale des détenus, le musée de Bank Al Maghrib (BAM) à Rabat a organisé en partenariat avec la Délégation Générale à l’administration pénitentiaire et à la réinsertion (DGAPR) et le Conseil national des droits de l’homme (CNDH), une exposition intitulée « Créations d’au-delà des murs ou Quand l’art libère ». Une manifestation qui durera de ce vendredi 13 décembre au 1er mars 2020.",13 Déc 2019
Les luthistes de Dar Al Ûd en concert à l’Académie du Royaume du Maroc à Rabat,"L’orchestre de luthistes Dar Al Ud a émerveillé, samedi soir, l’assistance lors d’un concert donné au siège de l’Académie du Royaume du Maroc à Rabat, en présence de nombreux invités du monde artistique, diplomatique et politique.",15 Déc 2019
Agadir : « Rafaël » remporte le Grand prix du Festival international Cinéma et Migrations,Le long métrage hollandais « Rafaël » a remporté le Grand prix de la 16ème édition du Festival international Cinéma et migrations (FICMA) qui s’est clôturée samedi soir à Agadir (9-14 décembre).,15 Déc 2019
Le Groupe MBC change de tête,"Il y a eu du changement à la tête du Groupe Saoudien MBC. Après la démission de Sam Barnett en octobre dernier du poste de Président directeur général de MBC, qu’il a occupé pendant 17 ans. Le Président du Conseil d’administration de MBC, Waleed Al-Ibrahim, a en effet nommé un nouveau PDG en la personne de Marc Antoine d’Halluin qui rejoindra le groupe MBC en janvier prochain .",09 Déc 2019
Marrakech a son musée privé de musique,L’infrastructure culturelle de Marrakech s’est enrichie ce dimanche avec l’inauguration d’un musée privé de la musique en présence d’une pléiade d’artistes et d’intellectuels.,09 Déc 2019
"IFM : « Nouvelle génération, la bande-dessinée arabe », pour initier les jeunes au monde de la BD",,10 Déc 2019
46ème session de l’Académie du Royaume du Maroc : La Chine et l’Afrique un partenariat win/win,La 46,10 Déc 2019
Centenaire du transport routier: Barid Al-Maghrib émet un timbre-poste commémoratif,"Le Groupe Barid Al-Maghrib a émis mardi, en partenariat avec la Compagnie de Transport au Maroc (CTM) anciennement connue sous le nom de Compagnie générale de Transport et de Tourisme au Maroc, un timbre-poste commémoratif à l’occasion du centenaire du transport routier.",11 Déc 2019
EN: le ministère reporte sine die ses réunions avec les syndicats,"Alors qu’elle était prévue ce mercredi à Rabat dans le cadre d’un dialogue sectoriel, une réunion entre la Direction centrale des ressources humaines du ministère de l’Éducation nationale, de la Formation professionnelle, de l’Enseignement supérieur et de la Recherche scientifique et les syndicats les 5 syndicats les plus représentatifs du secteur, a été annulée et reportée sine die. Les cinq syndicats ont en effet été informés de cette décision, sans recevoir davantage d’explications. Les détails.",11 Déc 2019
Prison Moul El Bergui : Démenti concernant des abus vis-à-vis d’un détenu,"L’administration de la prison centrale Moul El Bergui a démenti, mercredi, la teneur de la plainte de la mère du détenu (H.Z), publiée dans un journal national, qui allègue que ledit détenu a subi des abus.",11 Déc 2019
DGSN : Adoption de la procédure de présélection des candidats aux concours d’accès des rangs de la Police,"La Direction générale de la sûreté nationale (DGSN) a annoncé qu’elle a adopté la procédure de présélection des candidats aux concours d’accès aux différents cycles de la police qui auront lieu le 15 décembre courant, laquelle procédure fixe le seuil des notes annuelles et les moyennes requises après étude des dossiers de candidature reçus, et ce conformément aux dispositions de l’article 17 du statut des fonctionnaires de la DGSN, exigeant la procédure de présélection comme condition nécessaire pour passer les concours de la sûreté nationale. ",12 Déc 2019
16è FICMA : La Belgique à l’honneur,"Le coup d’envoi de la 16è édition du  Festival international « Cinéma et migrations » (FICMA) a été donné soir dans la ville d’Agadir, en présence d’une pléiade de personnalités des mondes cinématographique, médiatique et culturel. Il mettra 6 jours durant (09/14 décembre) le cinéma belge à l’hommeur.  ",10 Déc 2019
Académie du Royaume: Les expériences de modernisation et de développement de la Chine sous les projecteurs,"Les expériences de modernisation et de développement de la Chine ont servi de fil conducteur pour un débat d’idées tenu lundi lors de la deuxième séance de la 46ème session de l’Académie du Royaume du Maroc, placée sous le thème « l’Asie comme horizon de pensée ».",10 Déc 2019
Abandon de poste: La riposte des directions provinciales aux enseignants grévistes,"Les directions provinciales du ministère de l’Education nationale ont commencé à activer la procédure d’abandon de poste à l’encontre des enseignants titulaires de diplômes supérieurs, en grève nationale depuis le lundi 2 décembre dernier, a appris Hespress FR. PrévuE initialement jusqu’au vendredi 6, elle a finalement été prolongée du 9 au 14 de ce mois en guise de protestation contre le non règlement du dossier revendicatif de cette catégorie d’enseignants.",12 Déc 2019
Code Pénal : Quel avenir pour les libertés individuelles au Maroc?,"L’affaire Hajar Raissouni, la journaliste marocaine récemment poursuivie et emprisonnée pour relations sexuelles hors-mariage et avortement illégal, puis libérée suite à une grâce royale a rouvert les portes à un vaste débat qui fait rage depuis longtemps, celui de la question des libertés individuelles. Alors que les défenseurs des droits humains se sont mobilisés en masse pour mettre fin à ces lois liberticides, le Parlement examine une réforme du code pénal, sans grand changement pour l’instant. Qu’en sera-t-il dans le futur?",12 Déc 2019
DGSN: Le concours d’accès aura lieu ce dimanche,,11 Déc 2019
"Mohamed Nadif: Acteur, réalisateur et défenseur de la femme","Dans le cadre de la 18e édition du Festival international du film de Marrakech (FIFM), le dernier long-métrage de l’acteur et réalisateur marocain Mohamed Nadif, « ",07 Déc 2019
FIFM2019: Voici les lauréats de la 2e édition des Ateliers de l’Atlas,"Clap de fin pour la deuxième édition des Ateliers de l’Atlas, le programme industrie du Festival International du Film de Marrakech (FIFM), dédié aux cinémas d’Afrique et du Moyen-Orient, initié en 2018 en partenariat avec Netflix.",07 Déc 2019
FIFM2019: L’Etoile d’or à « Valley of Souls » du Colombien Rincon Gille,"Le film à « Valley of Souls », du Colombien Nicolas Rincon Gille, a décroché l’Etoile d’Or récompensant le meilleur de la 18è édition Festival du film de Marrakech (FIFM). ",07 Déc 2019
FIFM2019: Le Palmarès,"La 18è édition Festival International du Film de Marrakech (FIFM) s’est clôturée en beauté, ce samedi soir dans la cité ocre, par la remise des prix aux productions sectionnées et primées par le jury, présidé par l’actrice britannique Tilda Swinton. ",07 Déc 2019
L’IMA se joint à la célébration de la journée mondiale de la langue arabe,"La Journée mondiale de la langue arabe est célébrée le 18 décembre de chaque année. L’Institut du monde arabe (IMA), et pour la cinquième fois, se joint à cette célébration, à travers une programmation éclectique destinée à faire découvrir cette langue riche et à s’ouvrir a sa culture.",08 Déc 2019
L’exposition nationale « Mains de lumière » se pose à Tétouan,"Le vernissage de l’exposition nationale  »Mains de lumière », qui regroupe les oeuvres d’artistes marocains au talent avéré, s’est déroulé vendredi soir au Centre d’art moderne de Tétouan.",08 Déc 2019
L’exposition itinérante « Sédiments de voyage » fait escale à l’Aéroport Marrakech-Menara,"L’exposition artistique itinérante « Sédiments de voyage », initiée par l’Office National des Aéroports (ONDA) en partenariat avec « Fl’âme Art Gallery », a fait escale à l’Aéroport Marrakech-Menara, dans le cadre de la célébration, le 7 décembre de chaque année, de la Journée internationale de l’Aviation civile.",08 Déc 2019
Libertés individuelles: la riposte de Bouayach à El Othmani et Ramid,"La présidente du Conseil national des droits de l’Homme (CNDH) était sur le plateau de « Confidences de presse » diffusé par 2M. A charge, Elle est revenu sur les réactions du Chef du gouvernement et du ministre d’Etat chargé des droits de l’homme qui avaient, chacun de son coté, exprimé leur rejet du mémorandum soumis par le Conseil aux deux Chambres du parlement dans le cadre de la réforme attendue du Code pénal.",10 Déc 2019
CHU Ibn Sina: infirmiers et techniciens rueront dans les brancards tous les jeudis,Les infirmières et techniciens de santé des hôpitaux affiliés au Centre Hospitalier Universitaire (CHU) Ibn Sina de Rabat s’apprêtent à organiser tous les jeudis des sit-in devant la Direction de l’établissement pour faire valoir leur dossier revendicatif et appeler au dialogue. Une décision qu’ils qualifient d’« escalade » face au non traitement de leurs demandes.  ,10 Déc 2019
HCP : 57% de la population féminine a subi au moins un acte de violence,"Le Haut-Commissariat au Plan (HCP), a publié les premiers résultats de l’enquête sur la violence à l’encontre des femmes au Maroc, réalisée entre février et juillet 2019. Il en ressort que « parmi 13,4 millions de femmes âgées de 15 à 74 ans, plus de 7,6 millions ont subi au moins un acte de violence, tous contextes et toutes formes confondus durant les douze mois précédant l’enquête, soit 57% de la population féminine ».",10 Déc 2019
Droits de l’homme: Rien n’a changé selon Khadija Ryadi,"Il y a 71 ans, et plus exactement le 10 décembre 1948, la Déclaration universelle des droits de l’homme (DUDH) a été adoptée par l’Assemblée générale des Nations unies. Une déclaration qui définit les droits fondamentaux de l’Homme.",10 Déc 2019
Un détenu en garde à vue à  la prison locale d’Al Aarjat 2 se donne la mort,"Un détenu, placé en garde à vue à la prison locale d’Al Aarjat 2, s’est donné la mort « dans sa chambre, profitant de la sortie des autres détenus en récréation, pour enrouler une serviette autour de son cou en l’attachant à la fenêtre des toilettes », a fait savoir l’administration de cet établissement pénitentiaire",10 Déc 2019
2/8 décembre: 15 morts et 1.836 blessés dans les accidents en périmètre urbain,"Les 1.404 accidents de la circulation survenus en périmètre urbain lors de la période allant du 02 au 08 décembre, ont fait un total de 15 morts et 1.836 autres ont été blessées, dont 61 grièvement. ",11 Déc 2019
Journée mondiale des DH: Des demandes pour la libération des détenus islamistes,"Saisissant l’occasion de la Journée internationale des droits de l’Homme, et dans le cadre de sa « lutte » pour la libération des personnes ayant été impliquées dans des affaires liées au terrorisme, le Comité mixte pour la défense des détenus islamistes a tenu un sit-in ce mardi devant le parlement. La première revendication de ce groupe de soutien est la libération conditionnée des détenus qui continuent de purger leur peine, notamment ceux arrêtés suite aux attentats terroristes du 16 mai 2003 à Casablanca. Un accord a été signé en 2011, mais sans lendemain. ",10 Déc 2019
Valorisation des produits du terroir: l’UM5 se rapproche de l’Université de Bordeaux,"En collaboration avec l’Université de Bordeaux, la faculté des sciences de l’Université Mohammed V Rabat (FSR) a organisé ce mardi un atelier sur « ",10 Déc 2019
Académie Goncourt : Bernard Pivot tourne sa page,"Bernard Pivot, défenseur acharné de la langue française, quitte l’Académie Goncourt qu’il présidait depuis cinq ans et dont il était membre depuis quinze ans. L’annonce a été faite ce mardi sur les réseaux sociaux. ",04 Déc 2019
Le « vide juridique » fait ressortir les infirmiers dans la rue,"Un mois après leur dernière grève, les infirmiers et techniciens de santé du Royaume ont à nouveau observé un débrayage de 48h, les 9 et 10 décembre, accompagné de sit-in régionaux devant les directions régionales du ministère de la Santé. ",11 Déc 2019
L’Académie du Royaume du Maroc poursuit son exploration des grandes régions du monde,"Dans le cadre de son exploration des grandes régions du monde, en vue de créer des passerelles entre les intellectuels des deux bords et favoriser l’échange, le dialogue et les expériences diverses dans la perspective d’une approche pluridisciplinaire, l’Académie du Royaume du Maroc, va s’intéresser, pour sa 46 ème session, aux forces du changement qui façonnent l’Asie et comprendre les processus qui ont conduit ce continent vers des expériences de modernisation.",04 Déc 2019
FIFM2019: Campagne chirurgicale gratuite en faveur de 400 personnes,"Loin du tapis rouge, du cinéma et des projecteurs, la Fondation du Festival international du film de Marrakech (FIFM) organise du 2 au 7 décembre à l’hôpital Al Antaki de Marrakech, une campagne de chirurgie gratuite de la cataracte, et ce en partenariat avec la Fondation Hassan II d’ophtalmologie et le Ministère de la Santé. Dans un acte de générosité, plusieurs célébrités marocaines et arabes ont également rendu visite aux patients. ",04 Déc 2019
Hespress décroche le 2è Migration Media Award 2019,"Nouvelle distinction pour Hespress! Le site s’est adjugé la 2ème marche du podium du Migration Media Award (MMA) 2019, pour une production de ses journalistes Wael Burchachene et Otmane Baaj sur la migration, intitulée « du contenu web incite des mineurs marocains à opter pour le Hrig ».",04 Déc 2019
FIFM2019: l’émouvant hommage rendu à Mouna Fettou,"Pour ses 25 ans de carrière et plus au théâtre, télévision et cinéma, la 18",04 Déc 2019
Casablanca: Les personnes impliquées dans l’enlèvement d’un nourrisson arrêtées,"Les éléments de la police judiciaire du district de Sidi Bernoussi à Casablanca, en coordination avec les services de la Direction générale de la surveillance du territoire (DGST), ont retrouvé, samedi matin, un nourrisson dont l’enlèvement a été signalé, la veille, par sa mère.",07 Déc 2019
Philip Morris envisage de remplacer la cigarette normale par du tabac chauffé,"La cigarette est nocive pour la santé. C’est un constat reconnu mondialement par les fumeurs et les non-fumeurs. Pour les sociétés de tabac, il faut donc réagir pour garder les clients, tout en leur proposant une alternative de « moindre dangerosité ». Cela consisterait à changer les produits actuels, la cigarette normale sur le marché depuis des décennies, par d’autres moins nocifs, contenant beaucoup moins de substances toxiques et cancérigènes.",07 Déc 2019
"Rabat, patrimoine mondial: l’UNESCO met en garde","Baptisée « capitale marocaine de la culture », Rabat est désormais menacée de perdre sa place dans la liste de Patrimoine mondial qui lui a été attribué par l’UNESCO en 2012. La construction en cours du plus haut building d’Afrique, la Tour Mohammed VI, et le projet d’agrandissement de la gare de Rabat Ville sont derrière la mise en garde de l’organisation onusienne pour la culture. ",04 Déc 2019
Le Maroc et l’Unesco veulent renforcer leur coopération,"Le Maroc et l’Organisation des Nations Unies pour l’Éducation, la Science et la Culture (Unesco), qui entretiennent de puis longue date, des relations très fortes, sont déterminés à renforcer leur coopération bilatérale et la hisser à des niveaux supérieurs.",07 Déc 2019
Affaire du policier suspendu: Mise au point de la DGSN ,"Suspendu? Acquitté? Privé de salaire? L’affaire dans laquelle est poursuivi un policier suspendu,  continue de susciter des interrogations. Pour mettre fin à toute fausse allégation, la Direction générale de la sûreté nationale (DGSN), a rendu public une mise au point.",07 Déc 2019
"Retards, négligence…La mésaventure de passagers d’un vol de la RAM",Les scandales n’en finissent pas avec la Royal Air Maroc (RAM). Des passagers en provenance de Valence vers Casablanca à bord d’un avion de la RAM ont vécu un calvaire dans la soirée du mardi 3 décembre au mercredi 4 décembre. Tout cela dans l’indifférence et la négligence les plus totales des responsable de notre compagnie nationale.,08 Déc 2019
