title,resume,date
Académie du Royaume du Maroc : Le Welsh National Opéra offre un concert captivant,"L’Académie du Royaume du Maroc a accueilli l’opéra national du pays de Galles, le Welsh National Opéra, mercredi 04 décembre, pour un concert mémorable dans la capitale marocaine. Une première dans le Royaume pour la troupe galloise.",06 Déc 2019
JTC: « Un autre ciel » de Mohamed Horr en lice pour le Tanit d’or,"« Un autre ciel » du dramaturge marocain Mohamed al Horr, aux côtés de treize autres œuvres arabes et africaines, est en lice pour le Tanit d’Or, distinction suprême des Journées Théâtrales de Carthage (JTC), qui tiennent leur 21è édition du 7 au 15 décembre.",06 Déc 2019
Aziz Ghali: L’année 2019 n’a pas tenu ses promesses en matière de DH,"Depuis l’adoption en 1948 par les Nations Unies de la Déclaration universelle des droits de l’homme (DUDH), la journée internationale des droits humains sert de jauge pour les avancées (ou régressions) et offre l’occasion aux différentes partes concernées par la question, et investies (ou auto-investies) de la mission de défense de ces droits de faire le bilan. Depuis 71 ans",11 Déc 2019
28è session ordinaire du conseil supérieur des Oulémas les 13 et 14 décembre à Rabat,"Le Conseil supérieur des Oulémas, tiendra les 13 et 14 décembre sa 28è session ordinaire à Rabat, consacrée à l’examen de l’action, passé et future du Conseil.",11 Déc 2019
"Migration irrégulière: 101,7 M€ comme soutien de l’UE au Maroc","L’Union européenne (UE) a annoncé, mercredi, un soutien financier de 101,7 millions d’euros en faveur du Maroc pour l’aider à intensifier sa lutte contre la migration irrégulière et le trafic d’êtres humains.",11 Déc 2019
"Fort de sa diversité, le FIFM 2019 attire près de 105 000 festivaliers","Le Festival International du Film de Marrakech (FIFM) 2019 a été un véritable succès. Le FIFM a clôturé sa 18e édition, samedi soir, au Palais des congrès de la ville ocre. Une édition qui a compté la participation de près de 105 000 venus pour assister aux différents projections et activité de l’événement marrakchi. ",08 Déc 2019
"FIFM 2019: L’icône de Bollywood, Priyanka Chopra, célébrée à la Place Jemaa El Fna","Un vibrant hommage a été rendu, jeudi soir à la Place Jemaa El Fna, à l’icône de Bollywood, Priyanka Chopra Jonas, dans le cadre de la 18ème édition du Festival International du Film de Marrakech (FIFM).",06 Déc 2019
"Mariage des enfants: le Maroc persiste, et sa législation le permet","En collaboration avec l’Ambassade de Belgique, les agences du système des Nations Unies au Maroc, UNFPA, UNICEF et ONU Femmes ont saisi l’occasion de la campagne internationale des 16 jours d’activisme contre les violences faites aux femmes et aux filles pour organiser ce lundi à Rabat une rencontre débat autour du mariage des enfants au Maroc. Une remise en lumière de ce phénomène dans l’objectif souhaité de renforcer l’engagement pour y mettre fin. ",09 Déc 2019
L’Egypte récupère un manuscrit « coranique » rare,"Le ministère égyptien de la culture a annoncé, dimanche, avoir récupéré un manuscrit « coranique » rare vieux 500 ans, qui se trouvait en Royaume-uni.",09 Déc 2019
Lever de rideau à Tunis des 21è JTC,"Le rideau a été levé sur la 21ème édition des Journées Théâtrales de Carthage (JTC), avec la participation de plusieurs pays, dont le Maroc.",09 Déc 2019
La MAP lance 12 chaînes régionales,"L’Agence Maghreb Arabe presse (MAP), lance 12 chaînes TV régionales,  dont les deux premières, Casablanca et Oujda, seront lancées en 2020. ",09 Déc 2019
Un haut responsable à la wilaya de Marrakech pris en flagrant délit de corruption,"Le chef du service économique et social à la wilaya de Marrakech a été appréhendé, c",12 Déc 2019
46è session de l’Académie du Royaume : Regards croisés sur la percée chinoise en Afrique, ,09 Déc 2019
"FIFM 2019: Vibrant hommage au monstre sacré d’Hollywood, Robert Redford","Un hommage, aussi vibrant qu’exceptionnel, a été rendu, vendredi soir dans à Marrakech, par le Festival International du Film de Marrakech (FIFM), dans sa 18è édition, au monstre sacré d’Hollywood, l’acteur américain, Robert Redford.",07 Déc 2019
Les efforts du Maroc pour défendre les questions de la femme salués par ONU-Femmes,"La volonté politique du Maroc et l’engagement de la société civile dans la défense des questions de la femme, ont été salués par la représentante de l’ONU-Femmes Maghreb, Leila Rhiwi.",12 Déc 2019
Surpâturage dans le grand Souss: Assid glisse un mot à Laftit,,12 Déc 2019
Abdelhamid Benkhattab: Les partis politiques sont dépassés par la révolution digitale,"Les réseaux sociaux sont devenus l’espace n°1 où tout citoyen peut s’exprimer librement sur ses opinions, critiquer et lever également le voile sur les problématiques que connait la société. Ceci étant, il y a quelques décennies, l’espace de libération de la parole et de la pensée était le cadre des partis politiques qui jouaient un rôle important dans l’orientation et l’éducation de la masse sociétale mais aussi dans la réalisation de ses attentes.",13 Déc 2019
Rachid El Houdaigui décrypte les présences de la Chine et du Maroc en Afrique,"Rachid El Houdaigui, Professeur à l’Université Abdelmalek Essaadia, était parmi les intervenants dans le cadre de la 46",11 Déc 2019
Académie du Royaume : L’attractivité de l’Inde en question,La 46,11 Déc 2019
"« Everyday Life » : Le nouveau clip de Coldplay, tourné en partie au Maroc","Le Maroc est à l’honneur dans le nouveau clip de Coldplay. Le célèbre groupe britannique a choisi, en partie, le Royaume pour la vidéo de sa chanson « Everyday Life », publiée sur YouTube, lundi 9 décembre. ",12 Déc 2019
Les autorités locales d’Al Hoceima portent secours à deux alpinistes perdus au mont Tidirhine,"Deux alpinistes coincés au mont Tidirhine dans la commune d’Issaken (province d’Al Hoceima), après avoir perdu leur chemin de retour, ont été secourus ce jeudi par les autorités locales de la province d’Al Hoceima",12 Déc 2019
Mohamed Kettani : L’expérience asiatique mérite qu’on s’y attarde,,12 Déc 2019
Tanger-Med : Saisie de plus de 85.000 comprimés psychotropes,"Les éléments de la police judiciaire opérant au port de Tanger-Med ont réussi à mettre en échec, mercredi, une tentative de trafic d’une quantité de 85.650 comprimés psychotropes, de type Rivotril.",27 Nov 2019
Exposition de la photographe franco-espagnole Flore à partir du 21 décembre à Marrakech,"Après l’Egypte dans sa série « Sabah el Nour », l’artiste photographe franco-espagnole Flore jettera l’ancre à Marrakech, pour exposer du 21 décembre au 10 janvier prochain, ses récentes oeuvres sous le thème « Le Maroc, un temps suspendu ».",11 Déc 2019
HCP: La pauvreté parmi les sources de la violence conjugale au Maroc,"La pauvreté, les conflits d’intérêt matériel et le manque de communication constituent les principales sources de la violence dans le contexte conjugal, selon le Haut-Commissariat au plan (HCP).",12 Déc 2019
Salé : Quatre arrestations dans une affaire de trafic de drogue et de psychotropes,"La brigade anti-gang relevant de la police judiciaire de Salé a procédé, mercredi après-midi, sur la base d’informations précises fournies par les services de la Direction générale de la surveillance du territoire (DGST), à l’arrestation de quatre individus, âgés entre 30 et 42 ans, pour leur implication présumée dans une affaire de possession et de trafic de drogue et de psychotropes.",27 Nov 2019
Casablanca : Arrestation de deux individus pour usage de faux et tentative de corruption,"La brigade de la police judiciaire du district de la sûreté de Aïn Chock de Casablanca, ont procédé, mardi, à l’arrestation de deux individus pour leur implication présumée dans une affaire de faux et usage de faux et de tentative de corruption d’éléments de la police.",28 Nov 2019
Tanger : Un policier fait usage de son arme pour appréhender un individu dangereux,"Un inspecteur de police relevant de la brigade de recherche et d’intervention à la préfecture de police de Tanger a été contraint, jeudi, de brandir son arme de service sans en faire usage, pour arrêter un individu, soupçonné de violence sur ascendants et de mettre sérieusement en danger la sécurité des éléments de la police à l’aide d’une arme blanche.",29 Nov 2019
Arrestation à Marrakech d’un individu pour trafic de drogue,"La brigade antidrogue relevant de la Préfecture de police de Marrakech a réussi à mettre la main, mercredi, sur un individu pour trafic de drogue.",29 Nov 2019
Port de plaisance à Saïdia : Mise en échec d’une tentative d’émigration clandestine,"Une tentative d’émigration clandestine à partir du Port de plaisance de Saïdia à bord d’une embarcation pneumatique a été mise en échec vendredi à 3h du matin, suite à une opération commune menée par les services de la Sûreté nationale de Saïdia et la brigade maritime de la Gendarmerie Royale, sur la base d’informations précises fournies par la Direction générale de la surveillance du territoire.",29 Nov 2019
Casablanca : Un touriste juif décède suite à un accident de la circulation,"Un citoyen marocain de confession juive est décédé vendredi à Casablanca des suites de ses blessures dans un accident de la circulation, apprend-on auprès des autorités locales de la préfecture d’arrondissements de Ain Sebaa-Hay Mohammadi.",30 Nov 2019
Salé : Arrestation d’une Camerounaise pour une affaire de vol avec violences,"Les éléments du service préfectoral de la police judiciaire de Salé ont arrêté, vendredi soir, une ressortissante camerounaise qui était dans une situation de séjour illégal au Maroc, pour son implication présumée dans une affaire de coups et blessures avec tentative de vol dont un attaché militaire à l’ambassade d’Allemagne au Maroc a été victime.",30 Nov 2019
Oujda : Arrestation de plusieurs individus impliqués dans une affaire d’immigration clandestine,"Le service provincial de la police judiciaire d’Oujda a arrêté vendredi, sur la base d’informations précises fournies par les services de la Direction générale de la surveillance du territoire (DGST), trois individus, dont deux aux antécédents judiciaires pour l’organisation de l’émigration illégale, pour leurs liens présumés avec un réseau criminel actif dans la migration clandestine et la traite des êtres humains.",30 Nov 2019
Fès : Arrestation de trois individus impliqués dans une affaire de meurtre,"Les éléments du service préfectoral de la police judiciaire de Fès ont arrêté, samedi dans les premières heures du matin, le suspect principal dans une affaire de coups et blessures ayant entraîné la mort et deux autres suspectés d’avoir participé à ces actes criminels dont a été victime un individu aux antécédents judiciaires.",01 Déc 2019
Tanger : Arrestation du principal accusé dans une affaire de coups et blessures ayant entraîné la mort,"Les éléments du service préfectoral de la police judiciaire de Tanger ont procédé, dimanche, sur la base d’informations précises fournies par les services de la Direction générale de la surveillance du territoire, à l’arrestation d’un individu âgé de 34 ans soupçonné d’être le principal accusé dans une affaire de meurtre suite à des coups et blessures, enregistrée le 20 novembre à Ouezzane.",02 Déc 2019
Saisie de plus de 54.000 euros non déclarés au port de Tanger-Med,"Les éléments de la brigade conjointe de la Direction générale de la sûreté nationale (DGSN) et de l’Administration des douanes et impôts indirects opérant au port Tanger Med ont saisi, dimanche, une somme de 54.160 euros non-déclarés.",02 Déc 2019
"Fonctionnaires titulaires de diplômes, contractuels… la CDT en colère contre l’annulation d’une réunion par le MEN","Ça chauffe entre les syndicats de l’enseignement et le ministère de l’Éducation nationale. Dans une récente réunion, qui a regroupé les deux parties le 5 décembre, 22 dossiers ont été abordés, dont celui des fonctionnaires titulaires de diplômes d’études supérieures et leurs dossiers revendicatifs ainsi, que celui des enseignants recrutés par contrats auprès des académies régionales (AREF).",14 Déc 2019
Oujda : Les enfants et adolescents autistes profiteront bientôt d’un centre d’accueil,"La capitale de l’Oriental se dotera d’un centre d’accueil des enfants et adolescents autistes, dans le cadre d’une initiative caritative visant à aider cette catégorie à s’émanciper et s’intégrer dans la société.",15 Déc 2019
Un policier parvient à éviter un suicide à Rabat,"Dans une vidéo qui est largement devenue virale ce week-end, un jeune homme a tenté de s’immoler par le feu. C’était sans compter sur l’intervention d’un policier qui a empêché le drame. ",17 Nov 2019
Aéroport Mohammed V : Arrestation d’un Sénégalais faisant l’objet d’un mandat d’arrêt international,"Les éléments de la sûreté nationale de l’aéroport international Mohammed V de Casablanca ont arrêté, dimanche soir, un ressortissant sénégalais âgé de 33 ans, qui fait l’objet d’un mandat d’arrêt international émis par les autorités judiciaires mauritaniennes pour exécuter une décision judiciaire.",18 Nov 2019
OFPPT : un programme de grève à partir de lundi et mardi prochains,"La Coordination nationale des fonctionnaires titulaires de diplômes non comptabilisés à L’Office de la formation professionnelle et de la promotion du travail (OFPPT) prévoit un programme de contestation chargé. Elle entend mettre en œuvre ses premières phases les lundi et mardi prochains, en déclarant une « grève nationale », accompagnée d’un sit-in devant le siège de l’administration générale de l’Office à Casablanca.",14 Déc 2019
Un fourgon kamikaze fonce et entre dans le préside occupé de Sebta,"Un fourgon kamikaze, avec 52 migrants subsahariens à son bord, a défoncé la grille du poste frontière de Tarajal avant de pénétrer dans le préside occupé, au petit matin de ce lundi 18 novembre.",18 Nov 2019
Meknès : Arrestation de deux individus dans le cadre d’une affaire de drogue,"Le service préfectoral de la police judiciaire de Meknès a procédé, mardi, sur la base d’informations précises fournies par les services de la Direction générale de la surveillance du territoire (DGST), à l’arrestation de deux individus, âgés de 42 et 36 ans, pour leurs liens présumés avec un réseau criminel s’activant dans le trafic de drogue et de psychotropes.",19 Nov 2019
Marrakech : Ouverture d’une enquête à l’encontre d’un couple de trafiquants de drogues,"Le service préfectorale de la police judiciaire de Marrakech a ouvert, lundi soir, une enquête judiciaire sous la supervision du parquet compétent, en vue de vérifier les actes criminels reprochés à un couple présumé impliqué dans une affaire de possession et de trafic de drogue et de psychotropes. ",20 Nov 2019
Oujda : Arrestation de 11 subsahariens pour une affaire de trafic de drogues,"Les éléments du service préfectoral de la police judiciaire d’Oujda ont arrêté vendredi, sur la base d’informations précises fournies par les services de la Direction générale de la surveillance du territoire (DGST), onze ressortissants subsahariens, dont un mineur, pour leur implication présumée dans l’organisation de la migration clandestine, la traite humaine et le trafic de drogues, de psychotropes et d’alcool de contrebande.",23 Nov 2019
Espagne : Arrestation de neuf personnes soupçonnées d’avoir truqué un match de football,"La police nationale espagnole a annoncé, mardi, l’arrestation de neuf personnes soupçonnées d’avoir truqué un match de football de deuxième division.",26 Nov 2019
Accidents de la circulation : 1.707 blessés en périmètre urbain du 18 au 24 novembre,"Un total de 11 personnes ont trouvé la mort et 1.707 autres ont été blessées, dont 61 grièvement, dans 1.287 accidents de la circulation survenus en périmètre urbain au cours de la semaine allant du 18 au 24 novembre, a indiqué mardi la Direction générale de la sûreté nationale (DGSN). ",27 Nov 2019
Colloque national à Gulemim sur la peine de mort,Un colloque national sur « ,15 Déc 2019
"Miss France est guadeloupéenne, et n’échappe pas aux réactions mitigées sur le Web","Samedi 14 décembre se déroulait le concours annuel de Miss France, diffusé sur la chaîne française ",15 Déc 2019
Rabat : Arrestation de deux individus impliqués dans une affaire de vol avec violences,"Les éléments de la police judiciaire de Rabat ont arrêté jeudi deux individus, âgés de 20 et 23 ans, dont un récidiviste, pour liens présumés avec une bande criminelle impliquée dans une affaire de vol avec violence d’un local commercial.",21 Nov 2019
Tanger : Arrestation d’un individu recherché au niveau national,"Les éléments du service préfectoral de la police judiciaire de Tanger ont arrêté jeudi matin, sur la base d’informations précises fournies par les services de la Direction générale de la surveillance du territoire (DGST), un individu qui fait l’objet de 25 mandats de recherche au niveau national, et ce, dans les cadre des efforts intensifs menés par les services de la sûreté pour interpeller les individus recherchés au niveau national pour des affaires criminelles.",21 Nov 2019
Comment être une bonne shoppeuse en période de soldes ?,"Au Maroc, les soldes vont bon train et qui dit solde, dit forcément bonnes affaires et véritable aubaine pour les fashionistas marocaines. Comment réussir à dégoter les meilleures pièces aux meilleurs prix ? Hespress FR vous prodigue quelques précieux conseils. ",15 Déc 2019
Casablanca : 865 grammes de cocaïne extraits de l’estomac d’un ressortissant gambien,"Un total de 865 grammes de cocaïne, contenu dans 69 capsules, a été extrait de l’estomac d’un ressortissant gambien, âgé de 55 ans, au Centre hospitalier universitaire (CHU) Ibn Rochd à Casablanca, a-t-on appris auprès de la Préfecture de police de Casablanca.",21 Nov 2019
Fès : Arrestation de trois individus et saisie de plus d’une tonne de chira,"Les éléments du service préfectoral de la police judiciaire de Fès ont arrêté, jeudi matin, sur la base de données précises fournies par la Direction générale de la surveillance du territoire (DGST), trois individus pour leurs liens présumés avec un réseau criminel actif dans le trafic de drogue et de psychotropes.",21 Nov 2019
Coup d’envoi à Dcheira El Jihadia du 8è festival national de l’art des rwayes,"Le coup d’envoi de la 8è édition du festival national de l’art des rwayes a été donné récemment, à Dcheira El Jihadia, (préfecture d’Inezgane Ait-Melloul), en vue de célébrer cet art amazigh ancestral.",15 Déc 2019
Marrakech : Arrestation d’un Italien pour atteinte aux systèmes de traitement automatique de données,"Le service préfectoral de la police judiciaire de Marrakech a arrêté jeudi un ressortissant italien pour son implication présumée dans une affaire relative à l’atteinte aux systèmes de traitement automatique de données, ainsi qu’au transfert et au piratage des appels téléphoniques internationaux.",16 Nov 2019
Agadir : Un brigadier de police fait usage de son arme face à un individu dangereux,"Un brigadier de police relevant de l’unité mobile des motards de la préfecture de police d’Agadir a été contraint de faire usage de son arme de service, lundi, pour appréhender un individu qui mettait sérieusement en danger la sûreté des citoyens et des éléments de la police à l’aide d’une arme blanche.",11 Nov 2019
Casablanca : Un policier fait usage de son arme pour appréhender un malfrat,"Un agent de police travaillant au district de sûreté Fida Mers Sultane à Casablanca, a été contraint de brandir son arme de service sans en faire usage, lundi matin, lors d’une intervention sécuritaire pour appréhender un individu en état d’ivresse avancé, qui mettait sérieusement en danger la sûreté des citoyens et des éléments de la police à l’aide d’une arme blanche.",11 Nov 2019
Rabat : Arrestation d’un brigadier-chef de police soupçonné de corruption,"La brigade régionale de la police judiciaire de Rabat a ouvert, mardi, une enquête judiciaire sous la supervision du Parquet compétent, afin de vérifier les actes criminels reprochés à un agent de police de grade de brigadier-chef soupçonné d’implication dans une affaire de corruption, indique la Direction générale de la sûreté nationale (DGSN).",13 Nov 2019
Guelmim : Arrestation de trois personnes impliqués dans plusieurs activités illégales,"Les services de la police judiciaire de la ville de Guelmim ont arrêté, mercredi, sur la base de données précises fournies par la Direction générale de la surveillance du territoire national, trois personnes pour leur implication présumée dans des affaires de trafic international de drogue, organisation de l’immigration clandestine et émission de chèques sans provisions.",14 Nov 2019
Le 6è « KidsFest Tunisie » rend hommage aux costumes traditionnels marocains,La 6ème édition du ,15 Avr 2019
31 films sélectionnés pour le 18è festival national du film éducatif,La 18ème édition du festival national du film éducatif aura lieu du 25 au 29 avril à Fès sous le thème « ,16 Avr 2019
Mawazine 2019 : Quatre grandes figures du rap à l’OLM Souissi,"Le Hip Hop s’invite à la 18e édition de Mawazine et Rythmes du Monde, qui aura lieu du 20 au 29 juin à Rabat. Maroc Cultures a annoncé les grands noms de la scène urbaine qui se produiront à l’OLM Souissi, les 23 et 24 juin. Bigflo & Oli, Orelsan, Dadju ou encore Future, tous ont répondu à l’invitation. ",16 Avr 2019
L’Association Rabat-Salé Mémoire organise les Journées du patrimoine,"L’Association Rabat-Salé Mémoire a présenté, lundi à Rabat, le programme de la 5ème édition de ses ",17 Avr 2019
Lacement d’un guide sur la lutte contre le trafic illicite des biens culturels,Un guide relatif aux mécanismes de lutte contre le trafic des biens culturels vient d’être publié par le ministère de la Culture et de la Communication dans l’objectif de renforcer les capacités des formateurs en la matière pour une meilleure protection du patrimoine culturel.,16 Avr 2019
La raison de la présence de Maluma à Marrakech dévoilée,"Maluma a alimenté son compte Instagram de stories depuis son arrivée au Maroc. Installé à Marrakech pour un séjour qui semblaient comme des vacances sous le soleil, le chanteur colombien était en réalité dans la ville ocre pour enregistrer un duo avec le rappeur congolais, Maître Gims.",16 Avr 2019
Essaouira accueille la 19è édition du Festival des Alizés,"La 19è édition du Festival des Alizés, un rendez-vous exceptionnel dédié à la musique de chambre et à l’art lyrique, aura lieu du 25 au 28 avril, à l’initiative de l’Association Essaouira-Mogador.",17 Avr 2019
Trois Marocains distingués au Prix Charjah pour la création arabe," Trois marocains lauréats de la 22ème édition du prix Charjah pour la création arabe, ont reçus leurs distinctions, mercredi au Caire.",17 Avr 2019
Casablanca accueille les premières assises africaines du patrimoine culturel immatériel,Les premières Assises autour du patrimoine culturel immatériel en Afrique se tiendront les 18 et 19 avril à Casablanca sous le thème ,18 Avr 2019
"Se disant plagié par Gad Elmaleh, un humoriste québécois le tacle sévèrement",", tel a été le mot utilisé par l’humoriste québécois Martin Petit pour décrire les explications de Gad Elmaleh concernant les accusations de plagiat dont il fait l’objet depuis plusieurs mois, notamment de la part du Youtubeur CopyComics. ",16 Avr 2019
Maître Gims s’allie au groupe marocain Lamalif,"Le leader marocain de l’urbanisme et la star du rap Maître Gims s’associent pour un tout nouveau projet. Les deux parties ont signé, mardi 16 avril, à Marrakech, un protocole d’accord pour la création du groupe Lamalif Afrique.",17 Avr 2019
Tanger : Saisie d’environ 17 MDH de marchandises de contrebande,"Les éléments relevant de la Direction régionale de l’Administration des douanes et impôts indirects de Tanger-Tétouan-Al Hoceima, ont saisi, récemment, des marchandises de contrebande d’une valeur d’environ 17 millions de dirhams (MDH), a-t-on appris de source douanière.",30 Oct 2019
Tanger : Un Égyptien arrêté pour falsification de la monnaie nationale (DGSN),"Les éléments du service préfectoral de la police judiciaire de Tanger ont arrêté, jeudi, un ressortissant égyptien pour son implication présumée dans une affaire de falsification de la monnaie nationale et sa mise en circulation sur le marché.",01 Nov 2019
Tan-Tan : Destruction d’une grande quantité de drogue et de produits de contrebande,"Les services compétents ont procédé, récemment à Tan-Tan, à la destruction par incinération d’une grande quantité de drogues, d’alcool et de produits de contrebande, saisie au cours de plusieurs opérations effectuées au niveau de la région de Guelmim-Oud Noun durant la période allant du 9 juillet au 17 octobre.",02 Nov 2019
