title,resume,date
Addiction: MAPA plaide pour une action civique commune de prévention,"Addiction sous toutes ses formes, prévention, traitements…étaient au centre des travaux de la première conférence internationale sur les Addictions et Pathologies Associées, organisée par l’association de médecine addictive et pathologies associées (MAPA), en collaboration avec plusieurs partenaires et en présence de professionnels du monde médical, paramédical et autres acteurs de la santé des addictions au Maroc.",07 Déc 2019
Education: Balafrej tacle les enseignants et appelle à prioriser le secteur,Sous le thème « ,08 Déc 2019
Lalla Hasnaa préside la cérémonie du 30ème anniversaire de l’Association Al-Ihssane,"La Princesse Lalla Hasnaa, présidente d’honneur de l’Association Al-Ihssane, a présidé, dimanche à la maison d’enfants Lalla Hasnaa à Casablanca, la cérémonie de célébration du 30ème anniversaire de cette association.",08 Déc 2019
Le patrimoine rifain amazigh au cœur d’une exposition à Al Hoceima,"Une exposition qui jette la lumière sur différents aspects du patrimoine rifain amazigh a été organisée, samedi à Al Hoceima, en marge de la 1ère édition de l’évènement Théâtre des jeunes.",01 Déc 2019
Roger Federer figurera sur une pièce commémorative de 20 francs suisses,"Swissmint, l’organisme qui s’occupe de la frappe de la monnaie suisse, a annoncé, lundi, que Roger Federer figurera sur une pièce commémorative de 20 francs suisses.",03 Déc 2019
Les 10 types de Marocains que l’on rencontre pendant l’hiver,"L’hiver est arrivé plus tôt que prévu au Maroc, ne laissant pas le temps à ses habitants de s’y préparer. Un vent de froid et de désespoir qui souffle fort dans la vie de nombreux marocains, qui approchent cette période chacun à leur façon, en voici 10 types.",01 Déc 2019
FIFM : Lalla Hasnaa préside un dîner royal à l’occasion de l’ouverture du festival à Marrakech,"La princesse Lalla Hasnaa a présidé, samedi au Palais des Congrès à Marrakech, un dîner offert par le roi Mohammed VI, Que Dieu L’Assiste, à l’occasion de l’ouverture officielle de la 18è édition du Festival International du Film de Marrakech.",30 Nov 2019
Apprentissage des adultes: Les « progrès significatifs » du Maroc soulignés par l’Unesco ,"Les « progrès significatifs » faits par le Maroc en matière d’apprentissage des adultes, ont été mis en avant dans le dernier rapport de l’Organisation des Nations unies pour l’Education, la Science et la Culture (Unesco) sur cette question.",06 Déc 2019
Le Maroc à l’honneur au 24è festival de cinéma de Saragosse," Le Maroc était, du 14 au 30 novembre, l’invité d’honneur de la 24ème édition du Festival de cinéma de Saragosse, et s’est vu remettre à cette occasion une distinction spéciale en reconnaissance de la richesse et la diversité de la culture et de l’art marocains dans leurs multiples facettes. ",02 Déc 2019
FIFM2019: Quand Harvey Keitel raconte son amitié avec Martin Scorsese,"C’est dans la grande salle des ambassadeurs du Palais des congrès de Marrakech que le légendaire acteur américain Harvey Keitel a rencontré les professionnels du cinéma, presse, et public, ce lundi 2 décembre, au titre de la 18",03 Déc 2019
DG de l’AMCI: L’avenir de l’Afrique devrait passer par sa jeunesse,"La ville de Dakhla abrite la 6ème Rencontre internationale de son université ouverte, avec la participation d’éminentes personnalités du monde politique et de présidents de nombre d’universités internationales. Intervenant à cette occasion,  l’Ambassadeur directeur général de l’Agence marocaine de coopération internationale (AMCI), Mohamed Methqal, a assuré que « l’avenir durable de notre continent devrait passer par le développement de la jeunesse africaine ».",06 Déc 2019
Le Roi préside une veillée religieuse en commémoration du 21è anniversaire du décès de feu Hassan II,"Le Roi Mohammed VI, accompagné du Prince Héritier Moulay El Hassan et du Prince Moulay Rachid, a présidé, vendredi au Mausolée Mohammed V à Rabat, une veillée religieuse en commémoration du 21ème anniversaire de la disparition de Feu Hassan II.",06 Déc 2019
Le Roi préside une veillée religieuse marquant le 21è anniversaire de la disparition de feu Hassan II,"Le Roi Mohammed VI présidera, ce vendredi au Mausolée Mohammed V à Rabat, une veillée religieuse marquant le 21è anniversaire de la disparition de feu Hassan II, annonce un communiqué du ministère de la Maison Royale, du Protocole et de la Chancellerie. ",06 Déc 2019
CDG: Quels défis pour l’école de demain?,,06 Déc 2019
Lalla Meryem préside une veillée religieuse en commémoration du 21ème anniversaire de la disparition de Feu SM Hassan II,"La Princesse Lalla Meryem a présidé, vendredi à la mosquée Lalla Soukaina à Rabat, une veillée religieuse en commémoration du 21ème anniversaire de la disparition de Feu SM Hassan II.",06 Déc 2019
Début d’incendie au sous-sol d’ARRIBAT CENTER suite à un incident technique,"Un incident technique survenu cette fin de matinée au niveau du sous-sol du centre commercial ARRIBAT CENTER a entraîné un début d’incendie de faible intensité, n’ayant donné lieu à aucun blessé ni dégât matériel.",06 Déc 2019
Test PISA: Voici pourquoi le Maroc se retrouve en dernier,"Intervenant lors d’une conférence consacrée à « l’école de demain » de l’Institut CDG, Soumaya Maghnouj, analyste des politiques d’éducation au sein de la Direction de l’Éducation et des Compétences au sein de l’OCDE, est revenue en détails sur les indicateurs et les résultats de l’enquête PISA (Program for International Student Assessment) menée sur les élèves marocains. ",06 Déc 2019
Rabat-Salé-Témara : Les chauffeurs d’Alsa City Bus en grève,"Les autobus de la société Alsa-City, délégataire du transport urbain dans l’agglomération de Rabat-Salé-Témara, sont immobilisés en raison d’une grève des chauffeurs déclenchée jeudi.",07 Déc 2019
Bientôt un film sur la vie « mouvementée » de Michael Jackson,"Alerte au cinéphile ! Après l’énorme succès du film sur la vie de Freddie Mercury, «",26 Nov 2019
Le mandarin sera enseigné dans une école de la région de Tanger,"Désormais, le mandarin sera enseigné dans une école de la région de Tanger. Cette mesure a fait l’objet d’une convention de partenariat signée, ce mardi, entre la Fondation BMCE Bank pour l’Éducation et l’Environnement et l’Institut Confucius de Tanger-Université Abdelmalek Essaâdi.",04 Déc 2019
 25 novembre/1er décembre: 24 morts dans les accidents de la circulation en périmètre urbain,"Les 1.513 accidents de la circulation survenu en périmètre urbain lors de la semaine allant du 25 novembre au 1er décembre, ont fat un total de 24 morts et 1.929 blessés, dont 64 grièvement.",04 Déc 2019
Marrakech : Campagne de chirurgie plastique au profit d’une centaine de patients,Le Service de chirurgie maxillo-faciale relevant de l’hôpital Ibn Tofail à Marrakech organise une « campagne chirurgicale humanitaire » au profit de 101 patients atteints de cicatrices faciales.,04 Déc 2019
Marrakech : 687 personnes interpellées par la Brigade touristique à fin novembre,"La Brigade touristique relevant de la préfecture de police de Marrakech a procédé, au cours du mois de novembre dernier, à l’arrestation de 687 personnes pour différents délits.",05 Déc 2019
"Une peinture de Pierre Soulages vendue à 9,6 millions d’euros","Une œuvre de 1960 de Pierre Soulages a été vendue mercredi 9,6 millions d’euros (frais compris) chez Tajan à Paris. Ce prix dépasse largement celui prévu (entre 4 et 6 millions d’euros), à l’approche de l’exposition Soulages du Louvre.",28 Nov 2019
Sheikh Zayed Book Award: 7 titres marocains sélectionnés,Sept titres marocains ont été sélectionnés dans la longue liste des catégories « Contributions au développement des nations » et « Arts et études critiques » de la 14è édition du Prix Cheikh Zayed du Livre (Sheikh Zayed Book Award).,27 Nov 2019
Promotion du cinéma: Quand les autorités nagent à contre-courant,"Nul ne l’ignore, la ville d’Ouarzazate est une destination privilégiée pour les productions étrangères. Des tournages s’y déroulent à longueur d’année, et toutes les facilités sont apportées aux producteurs, notamment étrangers, au vu de la dynamique qu’ils insufflent à l’économie locale, et l’industrie cinématographique nationale en général.",27 Nov 2019
"Plus de cinq tonnes de chira saisies à Nador, un individu en fuite","Quelque cinq tonnes et 70 kg de chira enveloppés dans 169 grands paquets, ont été saisis, tôt dans la matinée du jeudi, par les éléments de la police judiciaire de Nador. ",05 Déc 2019
Signalisation routière: Du changement à venir,,05 Déc 2019
Economie et finances: le ministère trouve un premier accord avec les syndicats,"La réunion de négociation convoquée par le ministre de l’Economie, des Finances et de la Réforme de l’administration avec les représentants de l’Union nationale marocaine des syndicats démocratiques des Finances (USDF, affiliée à l’UMT) ce 3 décembre à Rabat a abouti à plusieurs résultats concernant le statut des fonctionnaires du ministère ainsi que leur système de retraite complémentaire. Précisions.",06 Déc 2019
"Test PISA: Le Maroc parmi les derniers, le ministère se justifie","Analyste des politiques d’éducation à l’OCDE, Soumaya Maghnouj a présenté ce mercredi au siège du ministère de l’Education nationale, une grille de lecture des ",05 Déc 2019
OCP Maintenance Solutions devient le premier centre certificateur Mobius au Maroc,"Le Groupe OCP, à travers sa « business unit » spécialisée dans la fiabilité et la maintenance, OCP Maintenance Solutions (OCP-MS), a pris part à la « CBM Conference », conférence de renommée mondiale, dédiée à la maintenance conditionnelle des machines, qui a lieu du 3 au 5 décembre 2019, à Monterrey au Mexique.",05 Déc 2019
Exploitation des enfants dans la mendicité: Un plan national est lancé,"Le coup d’envoi a été donné mercredi à Rabat au Plan d’action national pour la lutte contre l’exploitation des enfants à des fins de mendicité, qui repose sur le renforcement du système de protection de l’enfant de ce type d’exploitation en se basant sur le travail d’intervention d’équipes de terrain pluridisciplinaires dans différentes régions au niveau de la protection judiciaire, des soins de santé, de l’assistance psychologique et sociale, de l’éducation et la formation, ainsi que du suivi et de l’évaluation.",04 Déc 2019
Rabat abritera en juillet prochain l’assemblée générale de l’AIRF,"La ville de Rabat abritera, en juillet 2020, la 14è Assemblée générale (AG) de l’Association internationale des régions francophones (AIRF). Cette annonce a été faite à l’issue des travaux de la 13è AG de l’association qui se sont déroulés dimanche à Bamako avec la participation des représentants des pays membres, dont le Maroc.",01 Déc 2019
"Hélène Le Gal: Lead Campus 2, le fil rouge des leaders africains de demain","L’ambassadrice de France au Maroc, Hélène Le Gal a donné, ce jeudi, le coup d’envoi de la deuxième édition du programme Lead Campus, un programme destiné aux jeunes leaders africains. Objectif affiché: La valorisation de la  jeunesse africaine.",29 Nov 2019
Province de Ouarzazate : Caravane médicale pluridisciplinaire dans la commune de Télouet,Une caravane médicale pluridisciplinaire a été organisée récemment dans la commune territoriale de Télouet à l’initiative de la Délégation provinciale de la Santé et l’hôpital provincial de Ouarzazate.,03 Déc 2019
Bouachrine : Son épouse le déclare en grève de la faim,Le directeur du quotidien Akhbar Al Yaoum et du site d’information d’Al Yaoum 24 est en grève de la faim depuis dimanche pour « ,03 Déc 2019
Tuberculose: un réseau dément les chiffres officiels du ministère de la Santé,,03 Déc 2019
Al Hoceima : Lancement du projet « SAFAE et la démocratie » pour l’égalité des sexes,"Le Réseau des associations de développement actives dans la province d’Al Hoceima a organisé, samedi, une rencontre de communication pour le lancement du projet « SAFAE (soutien et accompagnement en faveur des femmes pour l’autonomisation et l’égalité) et la démocratie » visant à soutenir l’égalité entre les sexes.",02 Déc 2019
OIT : Amekraz à Abidjan pour une réunion régionale,"Le ministre de l’Emploi et de l’Intégration professionnelle, Mohamed Amekraz, est en tête de la délégation tripartite marocaine participant aux travaux de la 14e Réunion régionale africaine de l’Organisation Internationale du Travail (OIT), qui débute ce mardi à Abidjan, et se poursuit jusqu’au 6 décembre prochain. ",03 Déc 2019
Accident de Taza: Le bilan des morts s’alourdit,Le bilan des morts dans l’accident de l’auto,02 Déc 2019
"Après son hospitalisation, French Montana donne de ses nouvelles","French Montana semble être sorti d’affaire. Le rappeur d’origine marocaine a quitté les soins intensifs après avoir été hospitalisé d’urgence suite à une crise de panique chez lui, à Los Angeles. L’interprète de « Famous » a tenu à prévenir ses fans de son état de santé actuel tout en les remerciant d’avoir pris de ses nouvelles. ",29 Nov 2019
BCIJ: Démantèlement d’une cellule terroriste s’activant à Fekhana et Beni Nsar,"Le Bureau central d’investigation judiciaire (BCIJ), a démantelé une cellule terroriste composée de quatre personnes, âgées de 24 à 39 ans, partisanes de Daech et porteuses de projets terroristes, et qui s’activaient dans la région de Fekhana et Beni Nsar. ",04 Déc 2019
Médiateur du Royaume: Plus de 75.000 doléances formulées entre 2011 et 2018,"En l’espace de 7 ans, l’institution du médiateur du Royaume a reçu pas moins de 75.188 doléances, et a enregistré une hausse dans le nombre des plaintes de l’ordre de 2.93%, a indiqué un rapport annuel d’activité pour l’année 2018.",03 Déc 2019
Dons royaux au profit de plusieurs Zaouïas et Mausolées du royaume,"Une commission royale a procédé, jeudi, à la remise de dons royaux aux chorfas et adeptes de Mausolées et Zaouïa des villes d’Ouezzane, Larache, Chefchaouen et Tétouan, à l’occasion de l’anniversaire de la disparition de feu le roi Hassan II.",30 Nov 2019
Alsa commande 350 nouveaux bus chez Mercedes,"La société Alsa, nouveau délégataire du transport urbain à Casablanca, a passé une commande auprès de Mercedes-Benz pour l’acquisition de 350 nouveaux bus de modèle Conecto.",02 Déc 2019
"Des villes durables en Afrique, une question de survie",,03 Déc 2019
Errachidia : Hommage aux bacheliers les plus méritants de la région de Drâa-Tafilalet,"L’Académie régionale de l’éducation et de la formation (AREF) de Drâa-Tafilalet a organisé, vendredi à Errachidia, une cérémonie en hommage aux élèves ayant obtenu les meilleures notes lors des examens du baccalauréat au titre de l’année scolaire 2018-2019.",30 Nov 2019
Education : Hommage aux bacheliers de Dakhla-Oued Eddahab,"La Fondation Mohammed VI de promotion des œuvres sociales de l’éducation-formation a organisé, vendredi à Dakhla, une cérémonie en l’honneur des enfants d’adhérents ayant obtenu leur baccalauréat avec mention très bien au titre de l’année scolaire 2018-2019.",30 Nov 2019
Béni Mellal-Khénifra : Plusieurs enfants autistes bénéficient d’un programme de prise en charge,,01 Déc 2019
CIN biométriques : Une société française remporte l’appel d’offre de la DGSN,"Société française spécialisée dans les données numériques, Idemia, annoncé avoir remporté le contrat de renouvellement de la Carte d’identité nationale (CIN) dans le cadre de l’appel d’offres lancé par la Direction générale de la sécurité nationale (DGSN).",30 Nov 2019
Béni Melllah-Khénifra : 119 bourses octroyés par la Fondation Mohammed VI de promotion des œuvres sociales de l’éducation-formation,"Un total de 119 bacheliers ont bénéficié des bourses de mérite octroyées par la Fondation Mohammed VI de promotion des œuvres sociales de l’éducation-formation au profit des enfants de ses membres ayant obtenu leur baccalauréat avec mention, au niveau de la région Béni Mellal-Khénifra au titre de l’année de 2019, a atteint environ bénéficiaires sur 2919 bénéficiaires au niveau national. ",30 Nov 2019
Larache abrite le 6e Congrès national en médecine maritime,"Le 6e Congrès national en médecine maritime s’est tenu, samedi à Larache, sous le thème « ",01 Déc 2019
"SIDA, VIH, gare aux fausses idées reçues !","La journée mondiale de lutte contre le SIDA est de retour. Cette Maladie Sexuellement Transmissible (MST) mortelle est l’une des maladies qui font le plus peur, partout dans le monde. Des milliers de personnes meurent chaque année à cause de cette MST autour de laquelle la sensibilisation n’est pas toujours au rendez-vous. ",01 Déc 2019
« Moul Kaskita » : Jusqu’où préserver la liberté individuelle ?,"Un communiqué du Procureur du Roi près le tribunal de première instance de Settat, émis par la MAP dans la journée du 1",01 Déc 2019
Plusieurs morts dans un drame routier dans la région de Taza,"La région de Taza a été le théâtre d’un drame routier en ce début décembre. Plusieurs personnes ont trouvé la mort dans le renversement d’un autocar et d’une voiture, au niveau de Oued Imlil, sur l’axe routier reliant Taza à Guercif.",01 Déc 2019
Dakhla : Remise des certificats aux bénéficiaires du programme «Emergence des Compétences»,"Le centre de formation de la Fondation Phosboucrâa, Dakhla Learning Center (DLC), a organisé samedi la cérémonie de clôture du programme «Emergence des Compétences», marquée par la remise des certificats de formation aux 360 adhérentes et adhérents du programme, représentant trois promotions.",01 Déc 2019
Élections : L’Intérieur appelle à s’inscrire dans les listes jusqu’à fin décembre,,01 Déc 2019
Le Welsh National Opéra s’invite à l’Académie du Royaume au Maroc,,29 Nov 2019
Prince Moulay Rachid : « Le Festival International du Film de Marrakech revient cette année pour affirmer notre engagement en faveur du rapprochement des cultures »,"Après une édition riche en émotions, le Festival international du Film de Marrakech, dont le coup d’envoi de la 18ème édition a été donné vendredi soir au Palais des Congrès de la Cité ocre, « ",30 Nov 2019
"Le Festival international du Film de Marrakech,  comme si vous y étiez","La dix-huitième édition du festival international du film de Marrakech (FIFM) s’est ouverte vendredi au Palais des Congrès de la cité ocre. C’est S.A.R le prince Moulay Rachid, Président de la Fondation du Festival qui a donné le coup d’envoi en présence d’éminentes personnalités du cinéma en particulier, de la culture, des arts et des médias en général.",30 Nov 2019
Rencontres interculturelles : Des lycéens de Tourbes en visite au Maroc,"Dans le cadre des actions de coopération internationale (culture et loisirs), les élèves de terminale des Sciences et technologies de l’agronomie et du vivant (STAV) du lycée Bonne-Terre de Tourbes ont bénéficié d’une semaine de stage collectif, au Maroc, chez leur partenaire, l’association de développement d’Isfoutalil, qui œuvre à la rencontre interculturelle entre jeunes Marocains et Français",30 Nov 2019
La « routini alyaoumi » attitude analysée par Jaouad Mabrouki,"Prendre son smartphone, bien le positionner dans sa cuisine ou sa chambre, mettre une tenue qui montre parfaitement les rondeurs de son corps, et commencer à s’acquitter de ses  tâches ménagères, le tout immortalisé dans ce qui est devenu désormais une mode chez certaines youtubeuses marocaine, voire un concept, qui a même un nom ",04 Déc 2019
Nouakchott : Le caftan marocain brille lors d’un défilé de mode,"Le Centre culturel marocain de Nouakchott a abrité, vendredi soir, un défilé de mode traditionnel marocain au cours duquel la créatrice marocaine, Hanane Zouein, a présenté une collection de ses dernières créations, notamment le caftan, avec toute sa beauté et son authenticité.",30 Nov 2019
7è Prix de thèse Moyen-Orient et mondes musulmans 2020: l’Appel à candidature lancé,"Le GIS Moyen-Orient et mondes musulmans et l’Institut d’étude de l’Islam et des sociétés du monde musulman (IISMM, UMS 2000) ont annoncé l’organisation en 2020 de la septième édition du Prix de thèse Moyen-Orient et mondes musulmans.",29 Nov 2019
Education nationale: Premiers résultats du dialogue syndicats/ministère,"Rendant compte de leur réunion avec le directeur central des ressources humaines du ministère de tutelle, Mohamed Benzarhouni, les syndicats les plus représentatifs de l’Education nationale et de l’enseignement supérieur ont appelé le gouvernement et le ministère de Saïd Amzazi à répondre aux demandes des fonctionnaires du secteur et à « réaliser les revendications » qu’ils portent dans leur dossier revendicatif. ",07 Déc 2019
Lalla Meryem préside l’inauguration du Bazar international de Bienfaisance,,07 Déc 2019
Pharmacie: les professionnels du secteur planchent sur le projet de leur ordre,"Sur invitation du Président du Conseil national des pharmaciens du Maroc, Dr. Hamza Guedira, les présidents et membres des conseils régionaux, conseils de biologistes, industriels, distributeurs et dirigeants de syndicats nationaux, ont engagé une course contre la montre pour examiner le projet de loi ",07 Déc 2019
Les internautes saoudiens lancent un hashtag pour annuler le concert de Saad Lamjarred à Riyad,"Saad Lamjarred n’est pas le « bienvenu » en Arabie Saoudite. Sur les réseaux sociaux, le chanteur marocain, qui a partagé une publication de Turki Al Shikh, président de l’autorité de divertissement du pays, a annoncé qu’il se produira à Riyad, le 18 décembre prochain, dans le cadre du « Moussem » saoudien. Une nouvelle qui ne plait pas du tout aux Saoudiens, qui se sont mobilisés en masse sur les réseaux sociaux pour dénoncer la présence d’un artiste décrit comme « violeur ». ",03 Déc 2019
"FIFM2019: « The Irishman », un bouquet fait des acteurs fétiches de Martin Scorsese","Dans le cadre de la 18è édition du festival international du film de Marrakech, le grand public marrakchi et les professionnels du cinéma avaient rendez-vous avec le dernier chef oeuvre de Martin Scorsese, «",03 Déc 2019
Doha : Salim Hamidi remporte le premier prix de la Calligraphie arabe classique,Le calligraphe marocain Salim Hamidi a remporté le premier prix du Doha pour la créativité des jeunes dans la catégorie « Calligraphie arabe classique ».,04 Déc 2019
Gad Elmaleh annonce son retour sur scène avec un tout nouveau spectacle,"Gad Elmaleh is back ! L’humoriste franco-marocain a annoncé une grande nouvelle à ses fans : il retourne sur scène avec un tout nouveau spectacle. Cinq ans après « Sans Tambour », une tournée internationale et une aventure américaine, le natif de Casablanca est prêt à remonter sur les planches françaises.",04 Déc 2019
Projection au FCM de Bruxelles du film marocain « Le Miracle du Saint Inconnu »,"Le film marocain « Le Miracle du Saint Inconnu » du réalisateur Alaa Eddine Aljem a été projeté, mardi soir, dans le cadre de la section Panorama de la 19ème édition du festival du cinéma méditerranéen de Bruxelles.",04 Déc 2019
Digitalisation: L’Université Hassan 1er et Huawei Maroc travailleront ensemble,"En vue d’accélérer la digitalisation et promouvoir les compétences en Technologies de l’information et de la communication (TIC) au sein des universités et établissements supérieurs, l’Université Hassan 1er de Settat et Huawei Maroc ont signé une convention de partenariat.",09 Déc 2019
50 jeunes professionnels de 27 nationalités se joignent au réseau ADEL ,"Un groupe de 50 jeunes Atlantic Dialogues Emerging Leaders (ADEL), issus de 4 Continents et de 27 nationalités, participera, du 9 au 11 décembre, à la 8ème édition de la Conférence annuelle « Atlantic Dialogues » prévue du 12 au 14 courant à Marrakech.",10 Déc 2019
UI Green Metric 2019: les universités marocaines ne sont pas des amis de l’environnement,"Les universités Marocaines font le moindre effort, voire pas d’efforts, en matière de protection de l’environnement. Et c’est le classement « ",09 Déc 2019
Rabat : Un festival du riz pour célébrer l’amitié entre le Maroc et le Pakistan,"L’ambassade du Pakistan au Maroc a organisé, mercredi à Rabat, un festival pour célébrer l’amitié entre les deux pays, à travers une dégustation du riz pakistanais.",05 Déc 2019
FIFM2019: 3 questions à Hend Sabri,"Dans le cadre de la promotion du film « Noura rêve » de Hind Boujemaa, l’actrice tunisienne, Hend Sabri, fait son ",05 Déc 2019
"FIFM2019: Hommage, carrière, harcèlement … Mouna Fettou se confie","Pour sa 18é édition, le Festival international du film de Marrakech (FIFM) rend hommage à une grande artiste marocaine qui, pendant plus de 25 ans, a conquis le cœur et les esprits des Marocains. Il s’agit de l’actrice Mouna Fettou.",04 Déc 2019
